{
  "$schema":"https://json-schema.org/draft/2020-12/schema",
  "type":"object","additionalProperties":false,
  "required":["schema_version","policy_id","policy_version","cases"],
  "properties":{
    "schema_version":{"const":"1.0"},
    "policy_id":{"type":"string","minLength":1},
    "policy_version":{"type":"string","minLength":1},
    "cases":{"type":"array","minItems":1,"uniqueItems":true,"items":{"type":"object","additionalProperties":false,"required":["case_id","dimension","value","expected"],"properties":{"case_id":{"type":"string","minLength":1},"dimension":{"enum":["file_count","single_file_bytes","total_bytes","video_duration_seconds","recursion_depth","extension","partial_confirmation","accepted_count"]},"value":{"type":["integer","string","boolean"],"minimum":0},"expected":{"enum":["ACCEPT","REJECT","CONFIRMATION_REQUIRED","NO_ACTION_REQUEST"]},"reason_code":{"type":["string","null"]}}}}
  }
}
